{
  "version": 1,
  "protocol": {
    "warmup": 20,
    "samples": 50,
    "processCount": 3,
    "modes": [
      "legacy",
      "prepared"
    ]
  },
  "calibratedAt": "2026-09-04T22:09:24.657Z",
  "commit": "c00b280cd9cb19cdc8a476524d359bdaf334535f",
  "p95": {
    "PERF_T1": 20,
    "PERF_T2": 16,
    "PERF_T3": 50,
    "PERF_T4": 8,
    "PERF_T5": 50,
    "PERF_T6": 8,
    "PERF_T7": 50,
    "PERF_T8": 4
  }
}